Sheet: Feuille1
A1: Storm | B1: Web 2.0
B2: Url : | C2: http://public-storm.internetcollaboratif.info/storm/web-2-0/
B3: Création du storm : | C3: 2009-12-13T12:19:00
B4: Auteur du storm : | C4: Lory Mathieu
B6: Suggestions | C6: Qté | E6: % | F6: Url
B7: Internet | C7: 3 | D7: 10 | E7: of:=([.C7]/[.D7]) -> 0.3 | F7: http://public-storm.internetcollaboratif.info/storm/internet/
B8: Web | C8: 3 | D8: 10 | E8: of:=([.C8]/[.D8]) -> 0.3 | F8: http://public-storm.internetcollaboratif.info/storm/web/
B9: Réseau social | C9: 2 | D9: 10 | E9: of:=([.C9]/[.D9]) -> 0.2 | F9: http://public-storm.internetcollaboratif.info/storm/reseau-social/
B10: Online | C10: 1 | D10: 10 | E10: of:=([.C10]/[.D10]) -> 0.1 | F10: http://public-storm.internetcollaboratif.info/storm/online/
B11: Ajax | C11: 1 | D11: 10 | E11: of:=([.C11]/[.D11]) -> 0.1 | F11: http://public-storm.internetcollaboratif.info/storm/ajax/
B12: Network | C12: 1 | D12: 10 | E12: of:=([.C12]/[.D12]) -> 0.1 | F12: http://public-storm.internetcollaboratif.info/storm/network/
B13: Social | C13: 1 | D13: 10 | E13: of:=([.C13]/[.D13]) -> 0.1 | F13: http://public-storm.internetcollaboratif.info/storm/social/
B14: Flex | C14: 1 | D14: 10 | E14: of:=([.C14]/[.D14]) -> 0.1 | F14: http://public-storm.internetcollaboratif.info/storm/flex/
B15: Net | C15: 1 | D15: 10 | E15: of:=([.C15]/[.D15]) -> 0.1 | F15: http://public-storm.internetcollaboratif.info/storm/net/
B16: Révolution | C16: 1 | D16: 10 | E16: of:=([.C16]/[.D16]) -> 0.1 | F16: http://public-storm.internetcollaboratif.info/storm/revolution/